{
  "$schema": "https://deeplugin.store/data/launch-packet.schema.json",
  "version": 1,
  "plugin": {
    "id": "deeplugin-bb0e0b5de415c22fabfe",
    "name": "dsh-turn-fold",
    "author": "Winter-And-You-Gone",
    "category": "ui",
    "version": null,
    "homepage": "https://github.com/Winter-And-You-Gone/dsh-turn-fold",
    "firstObservedAt": "2026-08-19T01:55:30Z",
    "lastChangedAt": "2026-08-19T01:55:30Z"
  },
  "links": {
    "detail": "https://deeplugin.store/plugins/deeplugin-bb0e0b5de415c22fabfe.html",
    "feed": "https://deeplugin.store/plugins/deeplugin-bb0e0b5de415c22fabfe.atom.xml",
    "newFeed": "https://deeplugin.store/feeds/new.atom.xml",
    "updatedFeed": "https://deeplugin.store/feeds/updated.atom.xml"
  },
  "install": {
    "spec": "dsh-turn-fold",
    "command": "dsh plugin --profile web add dsh-turn-fold",
    "agentRequest": "请先在 deeplugin.store 中检索 Registry ID deeplugin-bb0e0b5de415c22fabfe，展示来源和精确安装 spec，为 web profile 生成安装计划；等我明确批准后再安装。"
  },
  "badge": {
    "markdown": "[![Listed on deeplugin.store](https://deeplugin.store/assets/deeplugin-listed.svg)](https://deeplugin.store/plugins/deeplugin-bb0e0b5de415c22fabfe.html)",
    "html": "<a href=\"https://deeplugin.store/plugins/deeplugin-bb0e0b5de415c22fabfe.html\"><img src=\"https://deeplugin.store/assets/deeplugin-listed.svg\" alt=\"Listed on deeplugin.store\"></a>"
  },
  "posts": {
    "zh": "dsh-turn-fold 已收录到 DeepSeek Harness Plugin Store。工具调用按 Think 段自动分组折叠；回合结束后整回合收成一个大组头，显示耗时/token/tok/s/缓存命中率指标。\n\n查看来源与安装：https://deeplugin.store/plugins/deeplugin-bb0e0b5de415c22fabfe.html",
    "en": "dsh-turn-fold is now listed on the DeepSeek Harness Plugin Store. Automatically folds tool calls into Think-segment groups and collapses each finished turn into a single header showing duration, token, throughput, and cache-hit metrics.\n\nSource and install details: https://deeplugin.store/plugins/deeplugin-bb0e0b5de415c22fabfe.html"
  }
}
