{
  "$schema": "https://deeplugin.store/data/launch-packet.schema.json",
  "version": 1,
  "plugin": {
    "id": "deeplugin-1ec677a12ad9094a2f4d",
    "name": "dsh-shell-command",
    "author": "CHplus0",
    "category": "tools",
    "version": null,
    "homepage": "https://github.com/CHplus0/dsh-shell-command",
    "firstObservedAt": "2026-08-19T14:56:47Z",
    "lastChangedAt": "2026-08-19T14:56:47Z"
  },
  "links": {
    "detail": "https://deeplugin.store/plugins/deeplugin-1ec677a12ad9094a2f4d.html",
    "feed": "https://deeplugin.store/plugins/deeplugin-1ec677a12ad9094a2f4d.atom.xml",
    "newFeed": "https://deeplugin.store/feeds/new.atom.xml",
    "updatedFeed": "https://deeplugin.store/feeds/updated.atom.xml"
  },
  "install": {
    "spec": "github:chplus0/dsh-shell-command",
    "command": "dsh plugin --profile web add github:chplus0/dsh-shell-command",
    "agentRequest": "请先在 deeplugin.store 中检索 Registry ID deeplugin-1ec677a12ad9094a2f4d，展示来源和精确安装 spec，为 web profile 生成安装计划；等我明确批准后再安装。"
  },
  "badge": {
    "markdown": "[![Listed on deeplugin.store](https://deeplugin.store/assets/deeplugin-listed.svg)](https://deeplugin.store/plugins/deeplugin-1ec677a12ad9094a2f4d.html)",
    "html": "<a href=\"https://deeplugin.store/plugins/deeplugin-1ec677a12ad9094a2f4d.html\"><img src=\"https://deeplugin.store/assets/deeplugin-listed.svg\" alt=\"Listed on deeplugin.store\"></a>"
  },
  "posts": {
    "zh": "dsh-shell-command 已收录到 DeepSeek Harness Plugin Store。Claude Code 风格的 shell 集成：/! 单命令分析 与 /terminal 交互式终端（带按需历史引用）。\n\n查看来源与安装：https://deeplugin.store/plugins/deeplugin-1ec677a12ad9094a2f4d.html",
    "en": "dsh-shell-command is now listed on the DeepSeek Harness Plugin Store. Claude Code-style shell integration: /! for single-command analysis and /terminal for interactive PTY sessions with on-demand history reference.\n\nSource and install details: https://deeplugin.store/plugins/deeplugin-1ec677a12ad9094a2f4d.html"
  }
}
