{
  "$schema": "https://deeplugin.store/data/launch-packet.schema.json",
  "version": 1,
  "plugin": {
    "id": "deeplugin-950d30ae770d2f9237af",
    "name": "dsh-pdf",
    "author": "zhtx2024",
    "category": "tools",
    "version": null,
    "homepage": "https://github.com/zhtx2024/dsh-pdf",
    "firstObservedAt": "2026-08-16T09:56:16Z",
    "lastChangedAt": "2026-08-16T09:56:16Z"
  },
  "links": {
    "detail": "https://deeplugin.store/plugins/deeplugin-950d30ae770d2f9237af.html",
    "feed": "https://deeplugin.store/plugins/deeplugin-950d30ae770d2f9237af.atom.xml",
    "newFeed": "https://deeplugin.store/feeds/new.atom.xml",
    "updatedFeed": "https://deeplugin.store/feeds/updated.atom.xml"
  },
  "install": {
    "spec": "github:zhtx2024/dsh-pdf",
    "command": "dsh plugin --profile web add github:zhtx2024/dsh-pdf",
    "agentRequest": "请先在 deeplugin.store 中检索 Registry ID deeplugin-950d30ae770d2f9237af，展示来源和精确安装 spec，为 web profile 生成安装计划；等我明确批准后再安装。"
  },
  "badge": {
    "markdown": "[![Listed on deeplugin.store](https://deeplugin.store/assets/deeplugin-listed.svg)](https://deeplugin.store/plugins/deeplugin-950d30ae770d2f9237af.html)",
    "html": "<a href=\"https://deeplugin.store/plugins/deeplugin-950d30ae770d2f9237af.html\"><img src=\"https://deeplugin.store/assets/deeplugin-listed.svg\" alt=\"Listed on deeplugin.store\"></a>"
  },
  "posts": {
    "zh": "dsh-pdf 已收录到 DeepSeek Harness Plugin Store。DSH 的 PDF 解析工具：pdf_info、pdf_extract_text、pdf_render_page 三件套，pdfjs 与自研渲染器双引擎，未内嵌 CJK 字体的 PDF 也能用系统字体渲染出图。\n\n查看来源与安装：https://deeplugin.store/plugins/deeplugin-950d30ae770d2f9237af.html",
    "en": "dsh-pdf is now listed on the DeepSeek Harness Plugin Store. PDF parsing tools for DSH: pdf_info, pdf_extract_text, and pdf_render_page with dual pdfjs and built-in rendering engines, including system-font rendering for PDFs with non-embedded CJK fonts.\n\nSource and install details: https://deeplugin.store/plugins/deeplugin-950d30ae770d2f9237af.html"
  }
}
