{
  "$schema": "https://deeplugin.store/data/launch-packet.schema.json",
  "version": 1,
  "plugin": {
    "id": "deeplugin-0ede791f205beec7effe",
    "name": "dsh-skin-manager",
    "author": "xiaoyangcheng84-svg",
    "category": "market",
    "version": null,
    "homepage": "https://github.com/xiaoyangcheng84-svg/dsh-skin-manager",
    "firstObservedAt": "2026-08-15T22:14:49Z",
    "lastChangedAt": "2026-08-19T01:55:30Z"
  },
  "links": {
    "detail": "https://deeplugin.store/plugins/deeplugin-0ede791f205beec7effe.html",
    "feed": "https://deeplugin.store/plugins/deeplugin-0ede791f205beec7effe.atom.xml",
    "newFeed": "https://deeplugin.store/feeds/new.atom.xml",
    "updatedFeed": "https://deeplugin.store/feeds/updated.atom.xml"
  },
  "install": {
    "spec": "github:xiaoyangcheng84-svg/dsh-skin-manager",
    "command": "dsh plugin --profile web add github:xiaoyangcheng84-svg/dsh-skin-manager",
    "agentRequest": "请先在 deeplugin.store 中检索 Registry ID deeplugin-0ede791f205beec7effe，展示来源和精确安装 spec，为 web profile 生成安装计划；等我明确批准后再安装。"
  },
  "badge": {
    "markdown": "[![Listed on deeplugin.store](https://deeplugin.store/assets/deeplugin-listed.svg)](https://deeplugin.store/plugins/deeplugin-0ede791f205beec7effe.html)",
    "html": "<a href=\"https://deeplugin.store/plugins/deeplugin-0ede791f205beec7effe.html\"><img src=\"https://deeplugin.store/assets/deeplugin-listed.svg\" alt=\"Listed on deeplugin.store\"></a>"
  },
  "posts": {
    "zh": "dsh-skin-manager 已收录到 DeepSeek Harness Plugin Store。DSH Web GUI 皮肤管理器：自动发现已安装皮肤，在独立设置页一键互斥切换，热载入无需重启。\n\n查看来源与安装：https://deeplugin.store/plugins/deeplugin-0ede791f205beec7effe.html",
    "en": "dsh-skin-manager is now listed on the DeepSeek Harness Plugin Store. Skin manager for the DSH web GUI: discovers installed skins and switches the active one from a dedicated Settings page, mutually exclusive, hot-reloaded without restart.\n\nSource and install details: https://deeplugin.store/plugins/deeplugin-0ede791f205beec7effe.html"
  }
}
