{
  "$schema": "https://deeplugin.store/data/launch-packet.schema.json",
  "version": 1,
  "plugin": {
    "id": "deeplugin-b5f7a752d6e9a4f0a9c3",
    "name": "DSH Browser",
    "author": "Lum1104",
    "category": "workflow",
    "version": "0.1.0",
    "homepage": "https://github.com/Lum1104/dsh-browser",
    "firstObservedAt": "2026-08-15T22:14:49Z",
    "lastChangedAt": "2026-08-15T22:14:49Z"
  },
  "links": {
    "detail": "https://deeplugin.store/plugins/deeplugin-b5f7a752d6e9a4f0a9c3.html",
    "feed": "https://deeplugin.store/plugins/deeplugin-b5f7a752d6e9a4f0a9c3.atom.xml",
    "newFeed": "https://deeplugin.store/feeds/new.atom.xml",
    "updatedFeed": "https://deeplugin.store/feeds/updated.atom.xml"
  },
  "install": {
    "spec": "github:lum1104/dsh-browser",
    "command": "dsh plugin --profile web add github:lum1104/dsh-browser",
    "agentRequest": "请先在 deeplugin.store 中检索 Registry ID deeplugin-b5f7a752d6e9a4f0a9c3，展示来源和精确安装 spec，为 web profile 生成安装计划；等我明确批准后再安装。"
  },
  "badge": {
    "markdown": "[![Listed on deeplugin.store](https://deeplugin.store/assets/deeplugin-listed.svg)](https://deeplugin.store/plugins/deeplugin-b5f7a752d6e9a4f0a9c3.html)",
    "html": "<a href=\"https://deeplugin.store/plugins/deeplugin-b5f7a752d6e9a4f0a9c3.html\"><img src=\"https://deeplugin.store/assets/deeplugin-listed.svg\" alt=\"Listed on deeplugin.store\"></a>"
  },
  "posts": {
    "zh": "DSH Browser 已收录到 DeepSeek Harness Plugin Store。Chrome sidebar extension that lets DSH operate your browser.\n\n查看来源与安装：https://deeplugin.store/plugins/deeplugin-b5f7a752d6e9a4f0a9c3.html",
    "en": "DSH Browser is now listed on the DeepSeek Harness Plugin Store. Chrome sidebar extension that lets DSH operate your browser.\n\nSource and install details: https://deeplugin.store/plugins/deeplugin-b5f7a752d6e9a4f0a9c3.html"
  }
}
