{
  "$schema": "https://deeplugin.store/data/launch-packet.schema.json",
  "version": 1,
  "plugin": {
    "id": "deeplugin-d5dbfc1f59a28c4b261b",
    "name": "dsh-model-picker",
    "author": "genius-alray",
    "category": "ui",
    "version": null,
    "homepage": "https://github.com/Sanqi-normal/dsh-model-picker",
    "firstObservedAt": "2026-08-16T08:41:44Z",
    "lastChangedAt": "2026-08-16T09:56:16Z"
  },
  "links": {
    "detail": "https://deeplugin.store/plugins/deeplugin-d5dbfc1f59a28c4b261b.html",
    "feed": "https://deeplugin.store/plugins/deeplugin-d5dbfc1f59a28c4b261b.atom.xml",
    "newFeed": "https://deeplugin.store/feeds/new.atom.xml",
    "updatedFeed": "https://deeplugin.store/feeds/updated.atom.xml"
  },
  "install": {
    "spec": "github:genius-alray/dsh-model-picker",
    "command": "dsh plugin --profile web add github:genius-alray/dsh-model-picker",
    "agentRequest": "请先在 deeplugin.store 中检索 Registry ID deeplugin-d5dbfc1f59a28c4b261b，展示来源和精确安装 spec，为 web profile 生成安装计划；等我明确批准后再安装。"
  },
  "badge": {
    "markdown": "[![Listed on deeplugin.store](https://deeplugin.store/assets/deeplugin-listed.svg)](https://deeplugin.store/plugins/deeplugin-d5dbfc1f59a28c4b261b.html)",
    "html": "<a href=\"https://deeplugin.store/plugins/deeplugin-d5dbfc1f59a28c4b261b.html\"><img src=\"https://deeplugin.store/assets/deeplugin-listed.svg\" alt=\"Listed on deeplugin.store\"></a>"
  },
  "posts": {
    "zh": "dsh-model-picker 已收录到 DeepSeek Harness Plugin Store。Web UI 模型选择器替换插件：对话框式选择，支持模糊搜索、供应商折叠分组、收藏与只看收藏过滤，以及思考档位下拉，复用官方组件库与 DSW 设计 token。\n\n查看来源与安装：https://deeplugin.store/plugins/deeplugin-d5dbfc1f59a28c4b261b.html",
    "en": "dsh-model-picker is now listed on the DeepSeek Harness Plugin Store. Dialog-style model picker for the DSH Web UI: fuzzy search, collapsible provider groups, favorites with a favorites-only filter, and a thinking-level dropdown, replacing the built-in model selector with official UI primitives and DSW tokens.\n\nSource and install details: https://deeplugin.store/plugins/deeplugin-d5dbfc1f59a28c4b261b.html"
  }
}
