{
  "$schema": "https://deeplugin.store/data/launch-packet.schema.json",
  "version": 1,
  "plugin": {
    "id": "deeplugin-a5bad08bd6fba5ad7380",
    "name": "dsh-calculator",
    "author": "bobcat848",
    "category": "ui",
    "version": null,
    "homepage": "https://github.com/bobcat848/dsh-calculator",
    "firstObservedAt": "2026-08-15T22:14:49Z",
    "lastChangedAt": "2026-08-15T22:14:49Z"
  },
  "links": {
    "detail": "https://deeplugin.store/plugins/deeplugin-a5bad08bd6fba5ad7380.html",
    "feed": "https://deeplugin.store/plugins/deeplugin-a5bad08bd6fba5ad7380.atom.xml",
    "newFeed": "https://deeplugin.store/feeds/new.atom.xml",
    "updatedFeed": "https://deeplugin.store/feeds/updated.atom.xml"
  },
  "install": {
    "spec": "github:bobcat848/dsh-calculator",
    "command": "dsh plugin --profile web add github:bobcat848/dsh-calculator",
    "agentRequest": "请先在 deeplugin.store 中检索 Registry ID deeplugin-a5bad08bd6fba5ad7380，展示来源和精确安装 spec，为 web profile 生成安装计划；等我明确批准后再安装。"
  },
  "badge": {
    "markdown": "[![Listed on deeplugin.store](https://deeplugin.store/assets/deeplugin-listed.svg)](https://deeplugin.store/plugins/deeplugin-a5bad08bd6fba5ad7380.html)",
    "html": "<a href=\"https://deeplugin.store/plugins/deeplugin-a5bad08bd6fba5ad7380.html\"><img src=\"https://deeplugin.store/assets/deeplugin-listed.svg\" alt=\"Listed on deeplugin.store\"></a>"
  },
  "posts": {
    "zh": "dsh-calculator 已收录到 DeepSeek Harness Plugin Store。右侧面板展示 DeepSeek API 费用（当前会话 + 全部会话累计）与账户余额，内置官方计价与峰谷计价支持。\n\n查看来源与安装：https://deeplugin.store/plugins/deeplugin-a5bad08bd6fba5ad7380.html",
    "en": "dsh-calculator is now listed on the DeepSeek Harness Plugin Store. DeepSeek API spend (current session and all sessions) and account balance in the aside panel, with official pricing and peak/off-peak support.\n\nSource and install details: https://deeplugin.store/plugins/deeplugin-a5bad08bd6fba5ad7380.html"
  }
}
