{
  "$schema": "https://deeplugin.store/data/launch-packet.schema.json",
  "version": 1,
  "plugin": {
    "id": "deeplugin-c8910e19299b644fd7b0",
    "name": "dsh-web-ui#dsh-git-graph",
    "author": "DamonKoy",
    "category": "ui",
    "version": null,
    "homepage": "https://github.com/DamonKoy/dsh-web-ui/tree/main/packages/dsh-git-graph",
    "firstObservedAt": "2026-08-17T03:14:45Z",
    "lastChangedAt": "2026-08-17T03:14:45Z"
  },
  "links": {
    "detail": "https://deeplugin.store/plugins/deeplugin-c8910e19299b644fd7b0.html",
    "feed": "https://deeplugin.store/plugins/deeplugin-c8910e19299b644fd7b0.atom.xml",
    "newFeed": "https://deeplugin.store/feeds/new.atom.xml",
    "updatedFeed": "https://deeplugin.store/feeds/updated.atom.xml"
  },
  "install": {
    "spec": "github:damonkoy/dsh-web-ui#path:/packages/dsh-git-graph",
    "command": "dsh plugin --profile web add github:damonkoy/dsh-web-ui#path:/packages/dsh-git-graph",
    "agentRequest": "请先在 deeplugin.store 中检索 Registry ID deeplugin-c8910e19299b644fd7b0，展示来源和精确安装 spec，为 web profile 生成安装计划；等我明确批准后再安装。"
  },
  "badge": {
    "markdown": "[![Listed on deeplugin.store](https://deeplugin.store/assets/deeplugin-listed.svg)](https://deeplugin.store/plugins/deeplugin-c8910e19299b644fd7b0.html)",
    "html": "<a href=\"https://deeplugin.store/plugins/deeplugin-c8910e19299b644fd7b0.html\"><img src=\"https://deeplugin.store/assets/deeplugin-listed.svg\" alt=\"Listed on deeplugin.store\"></a>"
  },
  "posts": {
    "zh": "dsh-web-ui#dsh-git-graph 已收录到 DeepSeek Harness Plugin Store。dsh web GUI 会话头部栏的 Git 分支选择器与提交图。\n\n查看来源与安装：https://deeplugin.store/plugins/deeplugin-c8910e19299b644fd7b0.html",
    "en": "dsh-web-ui#dsh-git-graph is now listed on the DeepSeek Harness Plugin Store. Git branch selector and Git graph in the conversation header of the dsh web GUI.\n\nSource and install details: https://deeplugin.store/plugins/deeplugin-c8910e19299b644fd7b0.html"
  }
}
