{
  "$schema": "https://deeplugin.store/data/launch-packet.schema.json",
  "version": 1,
  "plugin": {
    "id": "deeplugin-2b55396a29e751d27712",
    "name": "dsh-drawio",
    "author": "jean3690",
    "category": "tools",
    "version": null,
    "homepage": "https://github.com/jean3690/dsh-drawio",
    "firstObservedAt": "2026-08-19T14:56:47Z",
    "lastChangedAt": "2026-08-19T14:56:47Z"
  },
  "links": {
    "detail": "https://deeplugin.store/plugins/deeplugin-2b55396a29e751d27712.html",
    "feed": "https://deeplugin.store/plugins/deeplugin-2b55396a29e751d27712.atom.xml",
    "newFeed": "https://deeplugin.store/feeds/new.atom.xml",
    "updatedFeed": "https://deeplugin.store/feeds/updated.atom.xml"
  },
  "install": {
    "spec": "dsh-drawio",
    "command": "dsh plugin --profile web add dsh-drawio",
    "agentRequest": "请先在 deeplugin.store 中检索 Registry ID deeplugin-2b55396a29e751d27712，展示来源和精确安装 spec，为 web profile 生成安装计划；等我明确批准后再安装。"
  },
  "badge": {
    "markdown": "[![Listed on deeplugin.store](https://deeplugin.store/assets/deeplugin-listed.svg)](https://deeplugin.store/plugins/deeplugin-2b55396a29e751d27712.html)",
    "html": "<a href=\"https://deeplugin.store/plugins/deeplugin-2b55396a29e751d27712.html\"><img src=\"https://deeplugin.store/assets/deeplugin-listed.svg\" alt=\"Listed on deeplugin.store\"></a>"
  },
  "posts": {
    "zh": "dsh-drawio 已收录到 DeepSeek Harness Plugin Store。AI 驱动 drawio：四个画图工具（校验 / 渲染 SVG/PNG / 编辑 / 模板）+ 侧栏实时画板——零依赖 mxfile→SVG 预览、内嵌 diagrams.net 官方编辑器、AI 画图时自动弹出跟随。\n\n查看来源与安装：https://deeplugin.store/plugins/deeplugin-2b55396a29e751d27712.html",
    "en": "dsh-drawio is now listed on the DeepSeek Harness Plugin Store. AI-driven drawio: four agent tools (validate, render to SVG/PNG, edit, template) plus a sidebar live board — zero-dependency mxfile-to-SVG preview, embedded diagrams.net editor with save bridge, and auto-open whenever the agent draws.\n\nSource and install details: https://deeplugin.store/plugins/deeplugin-2b55396a29e751d27712.html"
  }
}
