{
  "$schema": "https://deeplugin.store/data/launch-packet.schema.json",
  "version": 1,
  "plugin": {
    "id": "deeplugin-97cac8623174380064e0",
    "name": "dsh-net-proxy",
    "author": "mafeis",
    "category": "tools",
    "version": null,
    "homepage": "https://github.com/mafeis/dsh-net-proxy",
    "firstObservedAt": "2026-08-15T22:14:49Z",
    "lastChangedAt": "2026-08-15T22:14:49Z"
  },
  "links": {
    "detail": "https://deeplugin.store/plugins/deeplugin-97cac8623174380064e0.html",
    "feed": "https://deeplugin.store/plugins/deeplugin-97cac8623174380064e0.atom.xml",
    "newFeed": "https://deeplugin.store/feeds/new.atom.xml",
    "updatedFeed": "https://deeplugin.store/feeds/updated.atom.xml"
  },
  "install": {
    "spec": "github:mafeis/dsh-net-proxy",
    "command": "dsh plugin --profile web add github:mafeis/dsh-net-proxy",
    "agentRequest": "请先在 deeplugin.store 中检索 Registry ID deeplugin-97cac8623174380064e0，展示来源和精确安装 spec，为 web profile 生成安装计划；等我明确批准后再安装。"
  },
  "badge": {
    "markdown": "[![Listed on deeplugin.store](https://deeplugin.store/assets/deeplugin-listed.svg)](https://deeplugin.store/plugins/deeplugin-97cac8623174380064e0.html)",
    "html": "<a href=\"https://deeplugin.store/plugins/deeplugin-97cac8623174380064e0.html\"><img src=\"https://deeplugin.store/assets/deeplugin-listed.svg\" alt=\"Listed on deeplugin.store\"></a>"
  },
  "posts": {
    "zh": "dsh-net-proxy 已收录到 DeepSeek Harness Plugin Store。让 agent 的网络请求走本机 HTTP/CONNECT/SOCKS5 代理。\n\n查看来源与安装：https://deeplugin.store/plugins/deeplugin-97cac8623174380064e0.html",
    "en": "dsh-net-proxy is now listed on the DeepSeek Harness Plugin Store. Route agent network requests through a local HTTP/CONNECT/SOCKS5 proxy.\n\nSource and install details: https://deeplugin.store/plugins/deeplugin-97cac8623174380064e0.html"
  }
}
